{"as_of":"2026-08-14","portfolio_ref":"active-portfolio/sha256/2ae8a31d00eb3f8f00be56f1c037ee1980bdecbe1e1edbeaa5b659042d9a9ef5","problem_card_schema":"AMF_PROBLEM_CARD_1","problem_catalog_sha256":"4e203b18e5a5d46422113ef63dc9798b93a184bbd451ce0247ea915e78b4f9ed","schema":"AMF_ACTIVE_PORTFOLIO_1","source_schema_version":1,"targets":[{"claim_scope":"RECORD_IMPROVEMENT","problem_card_sha256":"ff24ae26ddc2206625a765c5a67ff9bc7c360c42f0067ac4c2cff5aa4444eb73","problem_id":"degree-diameter-3-9-record","target_bundle":{"bytes":1413,"path":"targets/degree-diameter-3-9-record/target-bundle.json","sha256":"d52bd28631346c62c01705a57089ab9ada1e2818036cc3a45184fa4d661a08be"},"target_card_sha256":"bdd8f93bcc0fac09eb2a06fff262525b96e92c86486acba50484cd7189d74391","verification_mode":"exact_degree_connectivity_and_bfs_diameter_checker","verifier_id":"amf.dd39.exact.v1"},{"claim_scope":"FULL_PROBLEM","problem_card_sha256":"a75b3beccdf71f86bc425cecfe1485b82e849174ca528abf2351a4915f51b4e9","problem_id":"erdos-64","target_bundle":{"bytes":1286,"path":"targets/erdos-64/target-bundle.json","sha256":"5828b30484125444cef2905cbfceb2b274f41a12b09c2341dd35cf4d6e64af35"},"target_card_sha256":"106f5e6d4ad516a7eee5e38e43244769dc5254ce10d357505c90c853dc53fbcd","verification_mode":"exact_bounded_graph_counterexample_checker","verifier_id":"amf.erdos64.counterexample.v1"},{"claim_scope":"BOUNDED_COUNTEREXAMPLE","problem_card_sha256":"6d891e29afadbdc210962f87dc63add362ec2b1d5ee1a3de0886a70abef534c0","problem_id":"frontier-stretched-lr","target_bundle":{"bytes":1377,"path":"targets/frontier-stretched-lr/target-bundle.json","sha256":"81f12c4eb5a8cb1ec847b5b4df6e17b605e1d21dc46bd7b6536fe3cdb4842101"},"target_card_sha256":"1ab87748125aa10d24229cadc47c8d04a99add70aeb42465b8be8232b458aad8","verification_mode":"exact_integer_polynomial_two_implementations","verifier_id":"amf.stretched-lr.exact.v1"}],"verifier_registry_sha256":"f1ae94b7ab7ed8cf6f2f6b79579c33abd889a49168f530258858d89345a7a66e"}
